{
  "$schema": "../../schema.json",
  "id": "guide-overview",
  "title": "Обзор и границы знаний",
  "kind": "document",
  "category": "documentation",
  "maturity": {
    "spec": "complete",
    "markup": "available"
  },
  "knowledge": {
    "authority": [
      "migrated-source"
    ],
    "confidence": "high",
    "scope": "habr"
  },
  "purpose": "Размеры интерфейса берутся из machine/dimension-tokens.json; CSS-переменные подключаются через ui/habr.css. Новые абсолютные размеры, кратные 4px, не записываются литералами. Некратные значения перечислены в machine/reports/dimension-exceptions.md и не округляются автоматически.",
  "implementation": {
    "markup": null,
    "styles": [],
    "missingReason": "not-applicable-document",
    "fallback": "Read the linked Markdown document."
  },
  "states": {
    "ui": [],
    "feature": [],
    "domain": []
  },
  "examples": [],
  "evidence": [
    {
      "type": "source-document",
      "ref": "README.md"
    }
  ],
  "unknowns": [],
  "previewMode": "none",
  "markdown": "README.md"
}
