{
  "$schema": "../../schema.json",
  "id": "decision-dg-7-vybor-roli-i-cveta-knopki",
  "title": "DG-7 · Выбор роли и цвета кнопки",
  "kind": "document",
  "category": "documentation",
  "maturity": {
    "spec": "complete",
    "markup": "available"
  },
  "knowledge": {
    "authority": [
      "migrated-source"
    ],
    "confidence": "high",
    "scope": "habr"
  },
  "purpose": "OBSERVED. Роль (Primary/Success/Danger/Minor) и форма (fill/line/text) — независимые измерения (AC-1). Success работает как рабочая primary-CTA в разных контекстах, не только «подтверждение успеха» (AC-2).",
  "implementation": {
    "markup": null,
    "styles": [],
    "missingReason": "not-applicable-document",
    "fallback": "Read the linked Markdown document."
  },
  "states": {
    "ui": [],
    "feature": [],
    "domain": []
  },
  "examples": [],
  "evidence": [
    {
      "type": "source-document",
      "ref": "docs/rules/decision-dg-7-vybor-roli-i-cveta-knopki.md"
    }
  ],
  "unknowns": [],
  "previewMode": "none",
  "markdown": "docs/rules/decision-dg-7-vybor-roli-i-cveta-knopki.md"
}
