{
  "$schema": "../../schema.json",
  "id": "v1-overview",
  "title": "Исходный обзор v1",
  "kind": "document",
  "category": "documentation",
  "maturity": {
    "spec": "complete",
    "markup": "available"
  },
  "knowledge": {
    "authority": [
      "migrated-source"
    ],
    "confidence": "high",
    "scope": "habr"
  },
  "purpose": "Пакет знаний о визуальном языке и композиции Хабра (habr.com). Собран обратной разработкой: production release 2.346.1, Storybook (@storybook/vue3-vite), Figma-библиотека habr-lib и Figma-файл company admin m.habr-admin-company.",
  "implementation": {
    "markup": null,
    "styles": [],
    "missingReason": "not-applicable-document",
    "fallback": "Read the linked Markdown document."
  },
  "states": {
    "ui": [],
    "feature": [],
    "domain": []
  },
  "examples": [],
  "evidence": [
    {
      "type": "source-document",
      "ref": "docs/source/v1-overview.md"
    }
  ],
  "unknowns": [],
  "previewMode": "none",
  "markdown": "docs/source/v1-overview.md"
}
