{
  "$schema": "../../schema.json",
  "id": "decision-dg-13-sostoanie-vmesto-otdelnogo-ekrana",
  "title": "DG-13 · Состояние вместо отдельного экрана",
  "kind": "document",
  "category": "documentation",
  "maturity": {
    "spec": "complete",
    "markup": "available"
  },
  "knowledge": {
    "authority": [
      "migrated-source"
    ],
    "confidence": "high",
    "scope": "habr"
  },
  "purpose": "OBSERVED. Один и тот же блок услуги в admin переключается между формой действия и информером о статусе — не два разных экрана, а два состояния одного блока (AD-9, ST-2).",
  "implementation": {
    "markup": null,
    "styles": [],
    "missingReason": "not-applicable-document",
    "fallback": "Read the linked Markdown document."
  },
  "states": {
    "ui": [],
    "feature": [],
    "domain": []
  },
  "examples": [],
  "evidence": [
    {
      "type": "source-document",
      "ref": "docs/rules/decision-dg-13-sostoanie-vmesto-otdelnogo-ekrana.md"
    }
  ],
  "unknowns": [],
  "previewMode": "none",
  "markdown": "docs/rules/decision-dg-13-sostoanie-vmesto-otdelnogo-ekrana.md"
}
