{
  "$schema": "../../schema.json",
  "id": "pattern-taxonomy",
  "title": "Таксономия page patterns",
  "kind": "document",
  "category": "documentation",
  "maturity": {
    "spec": "complete",
    "markup": "available"
  },
  "knowledge": {
    "authority": [
      "migrated-source"
    ],
    "confidence": "high",
    "scope": "habr"
  },
  "purpose": "Снято перед сборкой showcase/pages.html, как и договаривались. Categories ниже — не готовый список, а результат прогона реальных источников через исследовательский чек-лист (feed/list, article/content, profile/entity, hub/company, search, editor/content creation, settings/forms, authenticated/admin, management lists, entity edit, modal/overlay). Career taxonomy не переносилась — категории выведены заново.",
  "implementation": {
    "markup": null,
    "styles": [],
    "missingReason": "not-applicable-document",
    "fallback": "Read the linked Markdown document."
  },
  "states": {
    "ui": [],
    "feature": [],
    "domain": []
  },
  "examples": [],
  "evidence": [
    {
      "type": "source-document",
      "ref": "evidence/pattern-taxonomy.md"
    }
  ],
  "unknowns": [],
  "previewMode": "none",
  "markdown": "evidence/pattern-taxonomy.md"
}
