{
  "$schema": "../../schema.json",
  "id": "rule-9-admin-ad",
  "title": "9 · Admin · AD",
  "kind": "document",
  "category": "documentation",
  "maturity": {
    "spec": "complete",
    "markup": "available"
  },
  "knowledge": {
    "authority": [
      "migrated-source"
    ],
    "confidence": "high",
    "scope": "habr"
  },
  "purpose": "Единственная категория, где источник — целиком Figma (m.habr-admin-company), не production. Все правила помечены Figma, не production.",
  "implementation": {
    "markup": null,
    "styles": [],
    "missingReason": "not-applicable-document",
    "fallback": "Read the linked Markdown document."
  },
  "states": {
    "ui": [],
    "feature": [],
    "domain": []
  },
  "examples": [],
  "evidence": [
    {
      "type": "source-document",
      "ref": "docs/rules/rule-9-admin-ad.md"
    }
  ],
  "unknowns": [],
  "previewMode": "none",
  "markdown": "docs/rules/rule-9-admin-ad.md"
}
