{
  "$schema": "../../schema.json",
  "id": "rule-8-overlays-ov",
  "title": "8 · Overlays · OV",
  "kind": "document",
  "category": "documentation",
  "maturity": {
    "spec": "complete",
    "markup": "available"
  },
  "knowledge": {
    "authority": [
      "migrated-source"
    ],
    "confidence": "high",
    "scope": "habr"
  },
  "purpose": "8 · Overlays · OV",
  "implementation": {
    "markup": null,
    "styles": [],
    "missingReason": "not-applicable-document",
    "fallback": "Read the linked Markdown document."
  },
  "states": {
    "ui": [],
    "feature": [],
    "domain": []
  },
  "examples": [],
  "evidence": [
    {
      "type": "source-document",
      "ref": "docs/rules/rule-8-overlays-ov.md"
    }
  ],
  "unknowns": [],
  "previewMode": "none",
  "markdown": "docs/rules/rule-8-overlays-ov.md"
}
